{"format":"game-rules-level","version":1,"coordinateSystem":{"origin":{"x":0,"y":0},"positiveX":"east","positiveY":"north"},"width":3,"height":1,"cells":[{"coordinate":{"x":0,"y":0},"type":"flat","elevation":0},{"coordinate":{"x":1,"y":0},"type":"flat","elevation":0},{"coordinate":{"x":2,"y":0},"type":"flat","elevation":0}],"fixtures":[],"entities":[{"id":"17","type":"player","coordinate":{"x":0,"y":0},"bottomHalfSteps":0},{"id":"4","type":"box","coordinate":{"x":1,"y":0},"bottomHalfSteps":0},{"id":"5","type":"barrel","coordinate":{"x":2,"y":0},"bottomHalfSteps":0}]}
