{"entities":[{"bottomHalfSteps":0,"coordinate":{"y":1,"x":2},"type":"player","id":"1"},{"bottomHalfSteps":2,"coordinate":{"y":0,"x":7},"type":"barrel","id":"7"},{"bottomHalfSteps":0,"coordinate":{"y":0,"x":6},"type":"box","id":"6"},{"bottomHalfSteps":2,"coordinate":{"y":0,"x":4},"type":"barrel","id":"9"},{"bottomHalfSteps":0,"coordinate":{"y":0,"x":3},"type":"box","id":"3"},{"bottomHalfSteps":0,"coordinate":{"y":0,"x":1},"type":"box","id":"2"},{"bottomHalfSteps":2,"coordinate":{"y":0,"x":0},"type":"barrel","id":"8"}],"fixtures":[],"cells":[{"elevation":0,"type":"flat","coordinate":{"y":1,"x":7}},{"elevation":0,"type":"flat","coordinate":{"y":1,"x":6}},{"elevation":0,"type":"flat","coordinate":{"y":1,"x":5}},{"elevation":0,"type":"flat","coordinate":{"y":1,"x":4}},{"elevation":0,"type":"flat","coordinate":{"y":1,"x":3}},{"elevation":0,"type":"flat","coordinate":{"y":1,"x":2}},{"elevation":0,"type":"flat","coordinate":{"y":1,"x":1}},{"elevation":0,"type":"flat","coordinate":{"y":1,"x":0}},{"elevation":0,"type":"flat","coordinate":{"y":0,"x":7}},{"elevation":0,"type":"flat","coordinate":{"y":0,"x":6}},{"elevation":0,"type":"flat","coordinate":{"y":0,"x":5}},{"elevation":0,"type":"flat","coordinate":{"y":0,"x":4}},{"elevation":0,"type":"flat","coordinate":{"y":0,"x":3}},{"elevation":0,"type":"flat","coordinate":{"y":0,"x":2}},{"elevation":0,"type":"flat","coordinate":{"y":0,"x":1}},{"elevation":0,"type":"flat","coordinate":{"y":0,"x":0}}],"height":2,"width":8,"coordinateSystem":{"positiveY":"north","positiveX":"east","origin":{"y":0,"x":0}},"version":1,"format":"game-rules-level"}
