{"entities":[{"bottomHalfSteps":0,"coordinate":{"y":0,"x":0},"type":"player","id":"1"},{"bottomHalfSteps":0,"coordinate":{"y":0,"x":1},"type":"box","id":"9"}],"fixtures":[{"color":"red","type":"switch","coordinate":{"y":0,"x":2}},{"color":"blue","type":"door","coordinate":{"y":0,"x":4}},{"color":"blue","type":"switch","coordinate":{"y":0,"x":0}},{"color":"red","type":"door","coordinate":{"y":0,"x":5}}],"cells":[{"elevation":0,"type":"flat","coordinate":{"y":0,"x":5}},{"elevation":0,"type":"flat","coordinate":{"y":0,"x":4}},{"elevation":0,"type":"flat","coordinate":{"y":0,"x":3}},{"elevation":0,"type":"flat","coordinate":{"y":0,"x":2}},{"elevation":0,"type":"flat","coordinate":{"y":0,"x":1}},{"elevation":0,"type":"flat","coordinate":{"y":0,"x":0}}],"height":1,"width":6,"coordinateSystem":{"positiveY":"north","positiveX":"east","origin":{"y":0,"x":0}},"version":1,"format":"game-rules-level"}
