{"format":"game-rules-level","version":1,"coordinateSystem":{"origin":{"x":10,"y":-4},"positiveX":"west","positiveY":"south"},"width":4,"height":2,"cells":[{"coordinate":{"x":13,"y":-3},"type":"flat","elevation":0},{"coordinate":{"x":12,"y":-3},"type":"flat","elevation":0},{"coordinate":{"x":11,"y":-3},"type":"flat","elevation":0},{"coordinate":{"x":10,"y":-3},"type":"flat","elevation":0},{"coordinate":{"x":13,"y":-4},"type":"flat","elevation":0},{"coordinate":{"x":12,"y":-4},"type":"flat","elevation":0},{"coordinate":{"x":11,"y":-4},"type":"ramp","lowDirection":"west","lowElevation":0},{"coordinate":{"x":10,"y":-4},"type":"flat","elevation":1}],"fixtures":[{"coordinate":{"x":13,"y":-3},"type":"door","color":"blue"},{"coordinate":{"x":12,"y":-3},"type":"door","color":"red"},{"coordinate":{"x":11,"y":-3},"type":"switch","color":"red"},{"coordinate":{"x":10,"y":-3},"type":"switch","color":"blue"}],"entities":[{"id":"9","type":"box","coordinate":{"x":11,"y":-3},"bottomHalfSteps":0},{"id":"18446744073709551615","type":"box","coordinate":{"x":11,"y":-4},"bottomHalfSteps":1},{"id":"1","type":"player","coordinate":{"x":10,"y":-3},"bottomHalfSteps":0}]}
