{"format":"game-rules-level","version":1,"coordinateSystem":{"origin":{"x":0,"y":0},"positiveX":"east","positiveY":"north"},"width":4,"height":1,"cells":[{"coordinate":{"x":0,"y":0},"type":"flat","elevation":2},{"coordinate":{"x":1,"y":0},"type":"flat","elevation":2},{"coordinate":{"x":2,"y":0},"type":"flat","elevation":0},{"coordinate":{"x":3,"y":0},"type":"flat","elevation":0}],"fixtures":[{"coordinate":{"x":2,"y":0},"type":"switch","color":"red"},{"coordinate":{"x":3,"y":0},"type":"door","color":"red"}],"entities":[{"id":"1","type":"player","coordinate":{"x":0,"y":0},"bottomHalfSteps":4},{"id":"2","type":"box","coordinate":{"x":1,"y":0},"bottomHalfSteps":4}]}
