{"format":"game-rules-level","version":1,"coordinateSystem":{"origin":{"x":8,"y":-4},"positiveX":"west","positiveY":"south"},"width":5,"height":1,"cells":[{"coordinate":{"x":8,"y":-4},"type":"flat","elevation":0},{"coordinate":{"x":9,"y":-4},"type":"flat","elevation":0},{"coordinate":{"x":10,"y":-4},"type":"flat","elevation":0},{"coordinate":{"x":11,"y":-4},"type":"flat","elevation":0},{"coordinate":{"x":12,"y":-4},"type":"flat","elevation":0}],"fixtures":[],"entities":[{"id":"91","type":"barrel","coordinate":{"x":10,"y":-4},"bottomHalfSteps":0},{"id":"900","type":"player","coordinate":{"x":11,"y":-4},"bottomHalfSteps":0}]}
