{"format":"game-rules-level","version":1,"coordinateSystem":{"origin":{"x":0,"y":0},"positiveX":"west","positiveY":"north"},"width":3,"height":3,"cells":[{"coordinate":{"x":0,"y":0},"type":"flat","elevation":0},{"coordinate":{"x":1,"y":0},"type":"flat","elevation":0},{"coordinate":{"x":2,"y":0},"type":"flat","elevation":0},{"coordinate":{"x":0,"y":1},"type":"flat","elevation":0},{"coordinate":{"x":1,"y":1},"type":"ramp","lowDirection":"east","lowElevation":0},{"coordinate":{"x":2,"y":1},"type":"flat","elevation":1},{"coordinate":{"x":0,"y":2},"type":"flat","elevation":0},{"coordinate":{"x":1,"y":2},"type":"flat","elevation":0},{"coordinate":{"x":2,"y":2},"type":"flat","elevation":0}],"fixtures":[],"entities":[{"id":"18446744073709551615","type":"player","coordinate":{"x":0,"y":1},"bottomHalfSteps":0}]}
