{"entities":[{"bottomHalfSteps":4,"coordinate":{"y":0,"x":4},"type":"player","id":"1"},{"bottomHalfSteps":4,"coordinate":{"y":0,"x":3},"type":"box","id":"8"}],"fixtures":[],"cells":[{"elevation":2,"type":"flat","coordinate":{"y":0,"x":4}},{"elevation":2,"type":"flat","coordinate":{"y":0,"x":3}},{"lowElevation":1,"lowDirection":"west","type":"ramp","coordinate":{"y":0,"x":2}},{"lowElevation":0,"lowDirection":"west","type":"ramp","coordinate":{"y":0,"x":1}},{"elevation":0,"type":"flat","coordinate":{"y":0,"x":0}}],"height":1,"width":5,"coordinateSystem":{"positiveY":"north","positiveX":"east","origin":{"y":0,"x":0}},"version":1,"format":"game-rules-level"}
