{"format":"game-rules-level","version":1,"coordinateSystem":{"origin":{"x":0,"y":0},"positiveX":"east","positiveY":"north"},"width":13,"height":1,"cells":[{"coordinate":{"x":0,"y":0},"type":"flat","elevation":0},{"coordinate":{"x":1,"y":0},"type":"flat","elevation":0},{"coordinate":{"x":2,"y":0},"type":"flat","elevation":0},{"coordinate":{"x":3,"y":0},"type":"flat","elevation":0},{"coordinate":{"x":4,"y":0},"type":"flat","elevation":0},{"coordinate":{"x":5,"y":0},"type":"flat","elevation":0},{"coordinate":{"x":6,"y":0},"type":"flat","elevation":0},{"coordinate":{"x":7,"y":0},"type":"flat","elevation":0},{"coordinate":{"x":8,"y":0},"type":"flat","elevation":0},{"coordinate":{"x":9,"y":0},"type":"flat","elevation":0},{"coordinate":{"x":10,"y":0},"type":"flat","elevation":0},{"coordinate":{"x":11,"y":0},"type":"flat","elevation":0},{"coordinate":{"x":12,"y":0},"type":"flat","elevation":0}],"fixtures":[{"coordinate":{"x":9,"y":0},"type":"door","color":"red"},{"coordinate":{"x":1,"y":0},"type":"switch","color":"red"},{"coordinate":{"x":5,"y":0},"type":"door","color":"yellow"},{"coordinate":{"x":3,"y":0},"type":"switch","color":"blue"},{"coordinate":{"x":7,"y":0},"type":"door","color":"blue"},{"coordinate":{"x":0,"y":0},"type":"switch","color":"red"},{"coordinate":{"x":8,"y":0},"type":"door","color":"green"},{"coordinate":{"x":4,"y":0},"type":"switch","color":"yellow"},{"coordinate":{"x":6,"y":0},"type":"door","color":"red"},{"coordinate":{"x":2,"y":0},"type":"switch","color":"green"}],"entities":[{"id":"40","type":"box","coordinate":{"x":4,"y":0},"bottomHalfSteps":0},{"id":"1","type":"player","coordinate":{"x":12,"y":0},"bottomHalfSteps":0},{"id":"20","type":"barrel","coordinate":{"x":1,"y":0},"bottomHalfSteps":0},{"id":"30","type":"box","coordinate":{"x":3,"y":0},"bottomHalfSteps":0},{"id":"10","type":"box","coordinate":{"x":0,"y":0},"bottomHalfSteps":0},{"id":"25","type":"box","coordinate":{"x":2,"y":0},"bottomHalfSteps":0}]}
